{
  "id": "reuben",
  "names": {
    "ru": "Рувим",
    "he": "רְאוּבֵן"
  },
  "type": "region",
  "placements": {
    "levant": {
      "x": 710,
      "y": 780
    }
  },
  "maps": [
    {
      "slug": "shvatim",
      "localId": "reuben"
    }
  ],
  "needsReview": false,
  "notes": "no-match: территория колена | территории 12 колен: тип region подтверждён, геометрия уделов появится в KA-6 (собственная генерализация по академическим атласам); needsReview снимается — записи структурно полны для своей роли"
}
