{
  "id": "aaron-mount",
  "names": {
    "ru": "Гора Ор",
    "he": "הֹר הָהָר"
  },
  "type": "mountain",
  "placements": {
    "levant": {
      "x": 622,
      "y": 972
    }
  },
  "maps": [
    {
      "slug": "ishod",
      "localId": "aaron_mount"
    }
  ],
  "needsReview": false,
  "sameAs": {
    "openbible": "mount-hor-1",
    "wikidata": "Q2915115"
  },
  "identifications": [
    {
      "status": "candidate",
      "label": "Har Zin",
      "lat": 30.832057,
      "lng": 35.056872,
      "accuracyMeters": 5000,
      "score": 336,
      "sources": [
        {
          "ref": "OpenBible.info geo: mount-hor-1 → har-zin",
          "level": "B"
        }
      ]
    },
    {
      "status": "alternative",
      "label": "Imaret el Khureisheh",
      "lat": 30.76517,
      "lng": 34.52912,
      "score": 114,
      "sources": [
        {
          "ref": "OpenBible.info geo: mount-hor-1 → imaret-el-khureisheh",
          "level": "B"
        }
      ]
    },
    {
      "status": "minor",
      "label": "Jebel es Sabha",
      "lat": 30.74704,
      "lng": 34.43891,
      "accuracyMeters": 5000,
      "score": 15,
      "sources": [
        {
          "ref": "OpenBible.info geo: mount-hor-1 → jebel-es-sabha",
          "level": "B"
        }
      ]
    },
    {
      "status": "rejected",
      "label": "Jebel el Hamrah",
      "lat": 30.68306,
      "lng": 34.56261,
      "accuracyMeters": 5000,
      "score": -2,
      "sources": [
        {
          "ref": "OpenBible.info geo: mount-hor-1 → jebel-el-hamrah",
          "level": "B"
        }
      ]
    },
    {
      "status": "rejected",
      "label": "Jebel Nebi Harun",
      "lat": 30.317,
      "lng": 35.407,
      "accuracyMeters": 5000,
      "score": -86,
      "sources": [
        {
          "ref": "OpenBible.info geo: mount-hor-1 → jebel-nebi-harun",
          "level": "B"
        }
      ]
    }
  ],
  "geo": {
    "lat": 30.832057,
    "lng": 35.056872,
    "accuracyMeters": 5000
  },
  "bibleRefs": [
    "Num 20:22",
    "Num 20:23",
    "Num 20:25",
    "Num 20:27",
    "Num 21:4"
  ]
}
