{
  "id": "gerasa",
  "names": {
    "ru": "Гераса",
    "he": "גֶּרַשָּׁא"
  },
  "type": "city",
  "placements": {
    "levant": {
      "x": 720,
      "y": 730
    }
  },
  "maps": [
    {
      "slug": "maccabim",
      "localId": "gerasa"
    }
  ],
  "needsReview": false,
  "sameAs": {
    "openbible": "gerasa",
    "wikidata": "Q31565"
  },
  "identifications": [
    {
      "status": "consensus",
      "label": "Jerash",
      "lat": 32.272281,
      "lng": 35.891397,
      "score": 1000,
      "sources": [
        {
          "ref": "OpenBible.info geo: gerasa → jerash",
          "level": "B"
        }
      ]
    }
  ],
  "geo": {
    "lat": 32.272281,
    "lng": 35.891397
  },
  "bibleRefs": [
    "Mark 5:1",
    "Luke 8:26",
    "Luke 8:37"
  ]
}
