{
  "id": "asher",
  "names": {
    "ru": "Асир",
    "he": "אָשֵׁר"
  },
  "type": "region",
  "placements": {
    "levant": {
      "x": 660,
      "y": 600
    }
  },
  "maps": [
    {
      "slug": "shvatim",
      "localId": "asher"
    }
  ],
  "needsReview": false,
  "notes": "no-match: территория колена — полигон собственной генерализации, не точка OpenBible | территории 12 колен: тип region подтверждён, геометрия уделов появится в KA-6 (собственная генерализация по академическим атласам); needsReview снимается — записи структурно полны для своей роли"
}
