{
  "id": "lahairoi",
  "names": {
    "ru": "Беэр-лахай-рои",
    "he": "בְּאֵר לַחַי רֹאִי"
  },
  "type": "spring",
  "placements": {
    "levant": {
      "x": 492,
      "y": 946
    }
  },
  "maps": [
    {
      "slug": "avraam",
      "localId": "lahairoi"
    }
  ],
  "needsReview": true,
  "sameAs": {
    "openbible": "beer-lahai-roi"
  },
  "identifications": [
    {
      "status": "candidate",
      "label": "Ain Muweileh",
      "lat": 30.6875,
      "lng": 34.333333,
      "score": 258,
      "sources": [
        {
          "ref": "OpenBible.info geo: beer-lahai-roi → ain-muweileh",
          "level": "B"
        }
      ]
    },
    {
      "status": "minor",
      "label": "Haluza",
      "lat": 31.097,
      "lng": 34.652,
      "score": 80,
      "sources": [
        {
          "ref": "OpenBible.info geo: beer-lahai-roi → haluza",
          "level": "B"
        }
      ]
    },
    {
      "status": "minor",
      "label": "Jebel Umm el Bared",
      "lat": 30.382414,
      "lng": 34.173133,
      "score": 58,
      "sources": [
        {
          "ref": "OpenBible.info geo: beer-lahai-roi → jebel-umm-el-bared",
          "level": "B"
        }
      ]
    },
    {
      "status": "minor",
      "label": "Wadi Umm Rajil",
      "lat": 30.76286,
      "lng": 34.12978,
      "score": 45,
      "sources": [
        {
          "ref": "OpenBible.info geo: beer-lahai-roi → wadi-umm-rajil",
          "level": "B"
        }
      ]
    }
  ],
  "geo": {
    "lat": 30.6875,
    "lng": 34.333333
  },
  "bibleRefs": [
    "Gen 16:14",
    "Gen 24:62",
    "Gen 25:11"
  ]
}
