{
  "id": "ephesus",
  "names": {
    "ru": "Эфес",
    "he": "Ἔφεσος"
  },
  "type": "city",
  "placements": {
    "mediterranean": {
      "x": 810,
      "y": 400
    }
  },
  "maps": [
    {
      "slug": "pavel",
      "localId": "ephesus"
    },
    {
      "slug": "revelation",
      "localId": "ephesus_rev"
    }
  ],
  "needsReview": false,
  "sameAs": {
    "openbible": "ephesus",
    "wikidata": "Q47611"
  },
  "identifications": [
    {
      "status": "consensus",
      "label": "Ephesus",
      "lat": 37.939125,
      "lng": 27.3407,
      "score": 1000,
      "sources": [
        {
          "ref": "OpenBible.info geo: ephesus → ephesus",
          "level": "B"
        }
      ]
    }
  ],
  "geo": {
    "lat": 37.939125,
    "lng": 27.3407
  },
  "bibleRefs": [
    "Acts 18:19",
    "Acts 18:21",
    "Acts 18:24",
    "Acts 18:27",
    "Acts 19:1"
  ],
  "notes": "review: Эфес: pavel + revelation — один город"
}
