{
  "id": "zebulun",
  "names": {
    "ru": "Завулон",
    "he": "זְבוּלֻן"
  },
  "type": "region",
  "placements": {
    "levant": {
      "x": 670,
      "y": 640
    }
  },
  "maps": [
    {
      "slug": "shvatim",
      "localId": "zebulun"
    }
  ],
  "needsReview": false,
  "notes": "no-match: территория колена | территории 12 колен: тип region подтверждён, геометрия уделов появится в KA-6 (собственная генерализация по академическим атласам); needsReview снимается — записи структурно полны для своей роли"
}
