{
  "id": "alexandria",
  "names": {
    "ru": "Александрия",
    "he": "Ἀλεξάνδρεια"
  },
  "type": "city",
  "placements": {
    "levant": {
      "x": 250,
      "y": 950
    }
  },
  "maps": [
    {
      "slug": "maccabim",
      "localId": "alexandria"
    }
  ],
  "needsReview": false,
  "sameAs": {
    "openbible": "alexandria",
    "wikidata": "Q87"
  },
  "identifications": [
    {
      "status": "consensus",
      "label": "Alexandria",
      "lat": 31.1825,
      "lng": 29.8965,
      "score": 1000,
      "sources": [
        {
          "ref": "OpenBible.info geo: alexandria → alexandria",
          "level": "B"
        }
      ]
    }
  ],
  "geo": {
    "lat": 31.1825,
    "lng": 29.8965
  },
  "bibleRefs": [
    "Acts 6:9",
    "Acts 18:24",
    "Acts 27:6",
    "Acts 28:11"
  ]
}
