{
  "id": "beth-zur",
  "names": {
    "ru": "Беф-Цур",
    "he": "בֵּית צוּר"
  },
  "type": "city",
  "placements": {
    "levant": {
      "x": 615,
      "y": 815
    }
  },
  "maps": [
    {
      "slug": "maccabim",
      "localId": "beth_zur"
    }
  ],
  "needsReview": false,
  "sameAs": {
    "openbible": "beth-zur",
    "wikidata": "Q4897432"
  },
  "identifications": [
    {
      "status": "primary",
      "label": "Khirbet et Tubeiqa",
      "lat": 31.589383,
      "lng": 35.094155,
      "score": 842,
      "sources": [
        {
          "ref": "OpenBible.info geo: beth-zur → khirbet-et-tubeiqa",
          "level": "B"
        }
      ]
    }
  ],
  "geo": {
    "lat": 31.589383,
    "lng": 35.094155
  },
  "bibleRefs": [
    "Josh 15:58",
    "1 Chr 2:45",
    "2 Chr 11:7",
    "Neh 3:16"
  ]
}
