{
  "id": "urfa",
  "names": {
    "ru": "Урфа (Шанлыурфа)",
    "he": "אוּרְהַי"
  },
  "type": "city",
  "placements": {
    "levant": {
      "x": 979,
      "y": 159
    }
  },
  "maps": [
    {
      "slug": "avraam",
      "localId": "urfa"
    }
  ],
  "needsReview": true,
  "notes": "no-match: Шанлыурфа — современный город, кандидат северной теории Ура/родины Авраама; остаётся отдельной записью-кандидатом | review-hold: запись-кандидат северной теории Ура; судьба записи решается при выравнивании карты avraam"
}
